FALSE,,160000000,"[{'id': 28, 'name': 'Action'}, {'id': 53, 'name': 'Thriller'}, {'id': 878, 'name': 'Science Fiction'}, {'id': 9648, 'name': 'Mystery'}, {'id': 12, 'name': 'Adventure'}]",http://inceptionmovie.warnerbros.com/,27205,tt1375666,en,Inception,"Cobb, a skilled thief who commits corporate espionage by infiltrating the subconscious of his targets is offered a chance to regain his old life as payment for a task considered to be impossible: ""inception"", the implantation of another person's idea into a target's subconscious.",29.108149,/qmDpIHrmpJINaRKAfWQfftjCdyi.jpg,"[{'name': 'Legendary Pictures', 'id': 923}, {'name': 'Warner Bros.', 'id': 6194}, {'name': 'Syncopy', 'id': 9996}]","[{'iso_3166_1': 'GB', 'name': 'United Kingdom'}, {'iso_3166_1': 'US', 'name': 'United States of America'}]",2010.7.14,825532764,148,"[{'iso_639_1': 'en', 'name': 'English'}]",Released,Your mind is the scene of the crime.,Inception,FALSE,8.1,14075
FALSE,"{'id': 263, 'name': 'The Dark Knight Collection', 'poster_path': '/bqS2lMgGkuodIXtDILFWTSWDDpa.jpg', 'backdrop_path': '/xfKot7lqaiW4XpL5TtDlVBA9ei9.jpg'}",185000000,"[{'id': 18, 'name': 'Drama'}, {'id': 28, 'name': 'Action'}, {'id': 80, 'name': 'Crime'}, {'id': 53, 'name': 'Thriller'}]",http://thedarkknight.warnerbros.com/dvdsite/,155,tt0468569,en,The Dark Knight,"Batman raises the stakes in his war on crime. With the help of Lt. Jim Gordon and District Attorney Harvey Dent, Batman sets out to dismantle the remaining criminal organizations that plague the streets. The partnership proves to be effective, but they soon find themselves prey to a reign of chaos unleashed by a rising criminal mastermind known to the terrified citizens of Gotham as the Joker.",123.167259,/1hRoyzDtpgMU7Dz4JF22RANzQO7.jpg,"[{'name': 'DC Comics', 'id': 429}, {'name': 'Legendary Pictures', 'id': 923}, {'name': 'Warner Bros.', 'id': 6194}, {'name': 'DC Entertainment', 'id': 9993}, {'name': 'Syncopy', 'id': 9996}]","[{'iso_3166_1': 'GB', 'name': 'United Kingdom'}, {'iso_3166_1': 'US', 'name': 'United States of America'}]",2008.7.16,1004558444,152,"[{'iso_639_1': 'en', 'name': 'English'}, {'iso_639_1': 'zh', 'name': '__'}]",Released,Why So Serious?,The Dark Knight,FALSE,8.3,12269
FALSE,"{'id': 87096, 'name': 'Avatar Collection', 'poster_path': '/nslJVsO58Etqkk17oXMuVK4gNOF.jpg', 'backdrop_path': '/9s4BM48NweGFrIRE6haIul0YJ9f.jpg'}",237000000,"[{'id': 28, 'name': 'Action'}, {'id': 12, 'name': 'Adventure'}, {'id': 14, 'name': 'Fantasy'}, {'id': 878, 'name': 'Science Fiction'}]",http://www.avatarmovie.com/,19995,tt0499549,en,Avatar,"In the 22nd century, a paraplegic Marine is dispatched to the moon Pandora on a unique mission, but becomes torn between following orders and protecting an alien civilization.",185.070892,/kmcqlZGaSh20zpTbuoF0Cdn07dT.jpg,"[{'name': 'Ingenious Film Partners', 'id': 289}, {'name': 'Twentieth Century Fox Film Corporation', 'id': 306}, {'name': 'Dune Entertainment', 'id': 444}, {'name': 'Lightstorm Entertainment', 'id': 574}]","[{'iso_3166_1': 'US', 'name': 'United States of America'}, {'iso_3166_1': 'GB', 'name': 'United Kingdom'}]",2009.12.10,2787965087,162,"[{'iso_639_1': 'en', 'name': 'English'}, {'iso_639_1': 'es', 'name': 'Español'}]",Released,Enter the World of Pandora.,Avatar,FALSE,7.2,12114
FALSE,"{'id': 86311, 'name': 'The Avengers Collection', 'poster_path': '/qJawKUQcIBha507UahUlX0keOT7.jpg', 'backdrop_path': '/zuW6fOiusv4X9nnW3paHGfXcSll.jpg'}",220000000,"[{'id': 878, 'name': 'Science Fiction'}, {'id': 28, 'name': 'Action'}, {'id': 12, 'name': 'Adventure'}]",http://marvel.com/avengers_movie/,24428,tt0848228,en,The Avengers,"When an unexpected enemy emerges and threatens global safety and security, Nick Fury, director of the international peacekeeping agency known as S.H.I.E.L.D., finds himself in need of a team to pull the world back from the brink of disaster. Spanning the globe, a daring recruitment effort begins!",89.887648,/cezWGskPY5x7GaglTTRN4Fugfb8.jpg,"[{'name': 'Paramount Pictures', 'id': 4}, {'name': 'Marvel Studios', 'id': 420}]","[{'iso_3166_1': 'US', 'name': 'United States of America'}]",2012.4.25,1519557910,143,"[{'iso_639_1': 'en', 'name': 'English'}]",Released,Some assembly required.,The Avengers,FALSE,7.4,12000
FALSE,"{'id': 448150, 'name': 'Deadpool Collection', 'poster_path': '/30c5jO7YEXuF8KiWXLg9m28GWDA.jpg', 'backdrop_path': '/hBQOWY8qWXJVFAc8yLTh1teIu43.jpg'}",58000000,"[{'id': 28, 'name': 'Action'}, {'id': 12, 'name': 'Adventure'}, {'id': 35, 'name': 'Comedy'}]",http://www.foxmovies.com/movies/deadpool,293660,tt1431045,en,Deadpool,"Deadpool tells the origin story of former Special Forces operative turned mercenary Wade Wilson, who after being subjected to a rogue experiment that leaves him with accelerated healing powers, adopts the alter ego Deadpool. Armed with his new abilities and a dark, twisted sense of humor, Deadpool hunts down the man who nearly destroyed his life.",187.860492,/inVq3FRqcYIRl2la8iZikYYxFNR.jpg,"[{'name': 'Twentieth Century Fox Film Corporation', 'id': 306}, {'name': 'Marvel Entertainment', 'id': 7505}, {'name': ""The Donners' Company"", 'id': 11307}, {'name': 'TSG Entertainment', 'id': 22213}, {'name': 'Kinberg Genre', 'id': 78091}]","[{'iso_3166_1': 'US', 'name': 'United States of America'}]",2016.2.9,783112979,108,"[{'iso_639_1': 'en', 'name': 'English'}]",Released,Witness the beginning of a happy ending,Deadpool,FALSE,7.4,11444
FALSE,,165000000,"[{'id': 12, 'name': 'Adventure'}, {'id': 18, 'name': 'Drama'}, {'id': 878, 'name': 'Science Fiction'}]",http://www.interstellarmovie.net/,157336,tt0816692,en,Interstellar,Interstellar chronicles the adventures of a group of explorers who make use of a newly discovered wormhole to surpass the limitations on human space travel and conquer the vast distances involved in an interstellar voyage.,32.213481,/nBNZadXqJSdt05SHLqgT0HuC5Gm.jpg,"[{'name': 'Paramount Pictures', 'id': 4}, {'name': 'Legendary Pictures', 'id': 923}, {'name': 'Warner Bros.', 'id': 6194}, {'name': 'Syncopy', 'id': 9996}, {'name': 'Lynda Obst Productions', 'id': 13769}]","[{'iso_3166_1': 'CA', 'name': 'Canada'}, {'iso_3166_1': 'US', 'name': 'United States of America'}, {'iso_3166_1': 'GB', 'name': 'United Kingdom'}]",2014.11.5,675120017,169,"[{'iso_639_1': 'en', 'name': 'English'}]",Released,Mankind was born on Earth. It was never meant to die here.,Interstellar,FALSE,8.1,11187
FALSE,,100000000,"[{'id': 18, 'name': 'Drama'}, {'id': 37, 'name': 'Western'}]",http://unchainedmovie.com/,68718,tt1853728,en,Django Unchained,"With the help of a German bounty hunter, a freed slave sets out to rescue his wife from a brutal Mississippi plantation owner.",19.785025,/5WJnxuw41sddupf8cwOxYftuvJG.jpg,"[{'name': 'Columbia Pictures', 'id': 5}, {'name': 'The Weinstein Company', 'id': 308}]","[{'iso_3166_1': 'US', 'name': 'United States of America'}]",2012.12.25,425368238,165,"[{'iso_639_1': 'en', 'name': 'English'}, {'iso_639_1': 'fr', 'name': 'Français'}, {'iso_639_1': 'de', 'name': 'Deutsch'}]",Released,"Life, liberty and the pursuit of vengeance.",Django Unchained,FALSE,7.8,10297
FALSE,"{'id': 284433, 'name': 'Guardians of the Galaxy Collection', 'poster_path': '/iL8mukexAqEg0xK783rG561tdd8.jpg', 'backdrop_path': '/jdyyjulTBU8YUYAUvQFj6U1g2Pj.jpg'}",170000000,"[{'id': 28, 'name': 'Action'}, {'id': 878, 'name': 'Science Fiction'}, {'id': 12, 'name': 'Adventure'}]",http://marvel.com/guardians,118340,tt2015381,en,Guardians of the Galaxy,"Light years from Earth, 26 years after being abducted, Peter Quill finds himself the prime target of a manhunt after discovering an orb wanted by Ronan the Accuser.",53.291601,/y31QB9kn3XSudA15tV7UWQ9XLuW.jpg,"[{'name': 'Marvel Studios', 'id': 420}, {'name': 'Moving Picture Company (MPC)', 'id': 20478}, {'name': 'Bulletproof Cupid', 'id': 54850}, {'name': 'Revolution Sun Studios', 'id': 76043}]","[{'iso_3166_1': 'GB', 'name': 'United Kingdom'}, {'iso_3166_1': 'US', 'name': 'United States of America'}]",2014.7.30,773328629,121,"[{'iso_639_1': 'en', 'name': 'English'}]",Released,All heroes start somewhere.,Guardians of the Galaxy,FALSE,7.9,10014
FALSE,,63000000,"[{'id': 18, 'name': 'Drama'}]",http://www.foxmovies.com/movies/fight-club,550,tt0137523,en,Fight Club,"A ticking-time-bomb insomniac and a slippery soap salesman channel primal male aggression into a shocking new form of therapy. Their concept catches on, with underground ""fight clubs"" forming in every town, until an eccentric gets in the way and ignites an out-of-control spiral toward oblivion.",63.869599,/adw6Lq9FiC9zjYEpOqfq03ituwp.jpg,"[{'name': 'Twentieth Century Fox Film Corporation', 'id': 306}, {'name': 'Regency Enterprises', 'id': 508}, {'name': 'Fox 2000 Pictures', 'id': 711}, {'name': 'Taurus Film', 'id': 20555}, {'name': 'Linson Films', 'id': 54050}, {'name': 'Atman Entertainment', 'id': 54051}, {'name': 'Knickerbocker Films', 'id': 54052}]","[{'iso_3166_1': 'DE', 'name': 'Germany'}, {'iso_3166_1': 'US', 'name': 'United States of America'}]",1999.10.15,100853753,139,"[{'iso_639_1': 'en', 'name': 'English'}]",Released,Mischief. Mayhem. Soap.,Fight Club,FALSE,8.3,9678
FALSE,"{'id': 131635, 'name': 'The Hunger Games Collection', 'poster_path': '/ttbKy12hDjSHQcM7sCoeW1WsDlW.jpg', 'backdrop_path': '/zWiiLNg8yXv0he3tCH6XignPaYV.jpg'}",75000000,"[{'id': 878, 'name': 'Science Fiction'}, {'id': 12, 'name': 'Adventure'}, {'id': 14, 'name': 'Fantasy'}]",http://www.thehungergames.movie/,70160,tt1392170,en,The Hunger Games,"Every year in the ruins of what was once North America, the nation of Panem forces each of its twelve districts to send a teenage boy and girl to compete in the Hunger Games.  Part twisted entertainment, part government intimidation tactic, the Hunger Games are a nationally televised event in which _ributes must fight with one another until one survivor remains.  Pitted against highly-trained Tributes who have prepared for these Games their entire lives, Katniss is forced to rely upon her sharp instincts as well as the mentorship of drunken former victor Haymitch Abernathy.  If she_ ever to return home to District 12, Katniss must make impossible choices in the arena that weigh survival against humanity and life against love. The world will be watching.",20.031667,/iLJdwmzrHFjFwI5lvYAT1gcpRuA.jpg,"[{'name': 'Lionsgate', 'id': 1632}, {'name': 'Color Force', 'id': 5420}]","[{'iso_3166_1': 'US', 'name': 'United States of America'}]",2012.3.12,691210692,142,"[{'iso_639_1': 'en', 'name': 'English'}]",Released,May The Odds Be Ever In Your Favor.,The Hunger Games,FALSE,6.9,9634
FALSE,"{'id': 8945, 'name': 'Mad Max Collection', 'poster_path': '/jZowUf4okNYuSlgj5iURE7CDMho.jpg', 'backdrop_path': '/zI0q2ENcQOLECbe0gAEGlncVh2j.jpg'}",150000000,"[{'id': 28, 'name': 'Action'}, {'id': 12, 'name': 'Adventure'}, {'id': 878, 'name': 'Science Fiction'}, {'id': 53, 'name': 'Thriller'}]",http://www.madmaxmovie.com/,76341,tt1392190,en,Mad Max: Fury Road,"An apocalyptic story set in the furthest reaches of our planet, in a stark desert landscape where humanity is broken, and most everyone is crazed fighting for the necessities of life. Within this world exist two rebels on the run who just might be able to restore order. There's Max, a man of action and a man of few words, who seeks peace of mind following the loss of his wife and child in the aftermath of the chaos. And Furiosa, a woman of action and a woman who believes her path to survival may be achieved if she can make it across the desert back to her childhood homeland.",29.36178,/kqjL17yufvn9OVLyXYpvtyrFfak.jpg,"[{'name': 'Village Roadshow Pictures', 'id': 79}, {'name': 'Kennedy Miller Productions', 'id': 2537}, {'name': 'Warner Bros.', 'id': 6194}]","[{'iso_3166_1': 'AU', 'name': 'Australia'}, {'iso_3166_1': 'US', 'name': 'United States of America'}]",2015.5.13,378858340,120,"[{'iso_639_1': 'en', 'name': 'English'}]",Released,What a Lovely Day.,Mad Max: Fury Road,FALSE,7.3,9629
FALSE,"{'id': 263, 'name': 'The Dark Knight Collection', 'poster_path': '/bqS2lMgGkuodIXtDILFWTSWDDpa.jpg', 'backdrop_path': '/xfKot7lqaiW4XpL5TtDlVBA9ei9.jpg'}",250000000,"[{'id': 28, 'name': 'Action'}, {'id': 80, 'name': 'Crime'}, {'id': 18, 'name': 'Drama'}, {'id': 53, 'name': 'Thriller'}]",http://www.thedarkknightrises.com/,49026,tt1345836,en,The Dark Knight Rises,"Following the death of District Attorney Harvey Dent, Batman assumes responsibility for Dent's crimes to protect the late attorney's reputation and is subsequently hunted by the Gotham City Police Department. Eight years later, Batman encounters the mysterious Selina Kyle and the villainous Bane, a new terrorist leader who overwhelms Gotham's finest. The Dark Knight resurfaces to protect a city that has branded him an enemy.",20.58258,/dEYnvnUfXrqvqeRSqvIEtmzhoA8.jpg,"[{'name': 'Legendary Pictures', 'id': 923}, {'name': 'Warner Bros.', 'id': 6194}, {'name': 'DC Entertainment', 'id': 9993}, {'name': 'Syncopy', 'id': 9996}]","[{'iso_3166_1': 'US', 'name': 'United States of America'}]",2012.7.16,1084939099,165,"[{'iso_639_1': 'en', 'name': 'English'}]",Released,The Legend Ends,The Dark Knight Rises,FALSE,7.6,9263
FALSE,"{'id': 2344, 'name': 'The Matrix Collection', 'poster_path': '/lh4aGpd3U9rm9B8Oqr6CUgQLtZL.jpg', 'backdrop_path': '/RhUxjzNojIJsdZSYTn0CQvdKsn.jpg'}",63000000,"[{'id': 28, 'name': 'Action'}, {'id': 878, 'name': 'Science Fiction'}]",http://www.warnerbros.com/matrix,603,tt0133093,en,The Matrix,"Set in the 22nd century, The Matrix tells the story of a computer hacker who joins a group of underground insurgents fighting the vast and powerful computers who now rule the earth.",33.366332,/hEpWvX6Bp79eLxY1kX5ZZJcme5U.jpg,"[{'name': 'Village Roadshow Pictures', 'id': 79}, {'name': 'Groucho II Film Partnership', 'id': 372}, {'name': 'Silver Pictures', 'id': 1885}, {'name': 'Warner Bros.', 'id': 6194}]","[{'iso_3166_1': 'AU', 'name': 'Australia'}, {'iso_3166_1': 'US', 'name': 'United States of America'}]",1999.3.30,463517383,136,"[{'iso_639_1': 'en', 'name': 'English'}]",Released,Welcome to the Real World.,The Matrix,FALSE,7.9,9079
FALSE,"{'id': 131292, 'name': 'Iron Man Collection', 'poster_path': '/fbeJ7f0aD4A112Bc1tnpzyn82xO.jpg', 'backdrop_path': '/rI8zOWkRQJdlAyQ6WJOSlYK6JxZ.jpg'}",140000000,"[{'id': 28, 'name': 'Action'}, {'id': 878, 'name': 'Science Fiction'}, {'id': 12, 'name': 'Adventure'}]",http://www.ironmanmovie.com/,1726,tt0371746,en,Iron Man,"After being held captive in an Afghan cave, billionaire engineer Tony Stark creates a unique weaponized suit of armor to fight evil.",22.073099,/848chlIWVT41VtAAgyh9bWymAYb.jpg,"[{'name': 'Paramount Pictures', 'id': 4}, {'name': 'Marvel Studios', 'id': 420}]","[{'iso_3166_1': 'US', 'name': 'United States of America'}]",2008.4.30,585174222,126,"[{'iso_639_1': 'en', 'name': 'English'}, {'iso_639_1': 'fa', 'name': 'ارس'}, {'iso_639_1': 'ur', 'name': 'ارد'}, {'iso_639_1': 'ar', 'name': 'اعربة'}]",Released,Heroes aren't born. They're built.,Iron Man,FALSE,7.4,8951
FALSE,"{'id': 131292, 'name': 'Iron Man Collection', 'poster_path': '/fbeJ7f0aD4A112Bc1tnpzyn82xO.jpg', 'backdrop_path': '/rI8zOWkRQJdlAyQ6WJOSlYK6JxZ.jpg'}",200000000,"[{'id': 28, 'name': 'Action'}, {'id': 12, 'name': 'Adventure'}, {'id': 878, 'name': 'Science Fiction'}]",http://marvel.com/ironman3,68721,tt1300854,en,Iron Man 3,"When Tony Stark's world is torn apart by a formidable terrorist called the Mandarin, he starts an odyssey of rebuilding and retribution.",23.721243,/1Ilv6ryHUv6rt9zIsbSEJUmmbEi.jpg,"[{'name': 'Marvel Studios', 'id': 420}]","[{'iso_3166_1': 'CN', 'name': 'China'}, {'iso_3166_1': 'US', 'name': 'United States of America'}]",2013.4.18,1215439994,130,"[{'iso_639_1': 'en', 'name': 'English'}]",Released,Unleash the power behind the armor.,Iron Man 3,FALSE,6.8,8951
FALSE,"{'id': 119, 'name': 'The Lord of the Rings Collection', 'poster_path': '/p4UokEk2XnjjRTdXGe6DLYXlbI1.jpg', 'backdrop_path': '/bccR2CGTWVVSZAG0yqmy3DIvhTX.jpg'}",93000000,"[{'id': 12, 'name': 'Adventure'}, {'id': 14, 'name': 'Fantasy'}, {'id': 28, 'name': 'Action'}]",http://www.lordoftherings.net/,120,tt0120737,en,The Lord of the Rings: The Fellowship of the Ring,"Young hobbit Frodo Baggins, after inheriting a mysterious ring from his uncle Bilbo, must leave his home in order to keep it from falling into the hands of its evil creator. Along the way, a fellowship is formed to protect the ringbearer and make sure that the ring arrives at its final destination: Mt. Doom, the only place where it can be destroyed.",32.070725,/bxVxZb5O9OxCO0oRUNdCnpy9NST.jpg,"[{'name': 'WingNut Films', 'id': 11}, {'name': 'New Line Cinema', 'id': 12}, {'name': 'The Saul Zaentz Company', 'id': 5237}]","[{'iso_3166_1': 'NZ', 'name': 'New Zealand'}, {'iso_3166_1': 'US', 'name': 'United States of America'}]",2001.12.18,871368364,178,"[{'iso_639_1': 'en', 'name': 'English'}]",Released,One ring to rule them all,The Lord of the Rings: The Fellowship of the Ring,FALSE,8,8892
FALSE,"{'id': 328, 'name': 'Jurassic Park Collection', 'poster_path': '/qIm2nHXLpBBdMxi8dvfrnDkBUDh.jpg', 'backdrop_path': '/pJjIH9QN0OkHFV9eue6XfRVnPkr.jpg'}",150000000,"[{'id': 28, 'name': 'Action'}, {'id': 12, 'name': 'Adventure'}, {'id': 878, 'name': 'Science Fiction'}, {'id': 53, 'name': 'Thriller'}]",http://www.jurassicworld.com/,135397,tt0369610,en,Jurassic World,"Twenty-two years after the events of Jurassic Park, Isla Nublar now features a fully functioning dinosaur theme park, Jurassic World, as originally envisioned by John Hammond.",32.790475,/jjBgi2r5cRt36xF6iNUEhzscEcb.jpg,"[{'name': 'Universal Studios', 'id': 13}, {'name': 'Amblin Entertainment', 'id': 56}, {'name': 'Legendary Pictures', 'id': 923}, {'name': 'Fuji Television Network', 'id': 3341}, {'name': 'Dentsu', 'id': 6452}]","[{'iso_3166_1': 'US', 'name': 'United States of America'}]",2015.6.9,1513528810,124,"[{'iso_639_1': 'en', 'name': 'English'}]",Released,The park is open.,Jurassic World,FALSE,6.5,8842
FALSE,,8000000,"[{'id': 53, 'name': 'Thriller'}, {'id': 80, 'name': 'Crime'}]",,680,tt0110912,en,Pulp Fiction,"A burger-loving hit man, his philosophical partner, a drug-addled gangster's moll and a washed-up boxer converge in this sprawling, comedic crime caper. Their adventures unfurl in three stories that ingeniously trip back and forth in time.",140.950236,/dM2w364MScsjFf8pfMbaWUcWrR.jpg,"[{'name': 'Miramax Films', 'id': 14}, {'name': 'A Band Apart', 'id': 59}, {'name': 'Jersey Films', 'id': 216}]","[{'iso_3166_1': 'US', 'name': 'United States of America'}]",1994.9.10,213928762,154,"[{'iso_639_1': 'en', 'name': 'English'}, {'iso_639_1': 'es', 'name': 'Español'}, {'iso_639_1': 'fr', 'name': 'Français'}]",Released,Just because you are a character doesn't mean you have character.,Pulp Fiction,FALSE,8.3,8670
FALSE,"{'id': 121938, 'name': 'The Hobbit Collection', 'poster_path': '/hm2VtxeCBqWJnPNmvXPPXiHydyp.jpg', 'backdrop_path': '/7wO7MSnP5UcwR2cTHdJFF1vP4Ie.jpg'}",250000000,"[{'id': 12, 'name': 'Adventure'}, {'id': 14, 'name': 'Fantasy'}, {'id': 28, 'name': 'Action'}]",http://www.thehobbit.com/,49051,tt0903624,en,The Hobbit: An Unexpected Journey,"Bilbo Baggins, a hobbit enjoying his quiet life, is swept into an epic quest by Gandalf the Grey and thirteen dwarves who seek to reclaim their mountain home from Smaug, the dragon.",23.253089,/ysX7vDmSh5O19vFjAi56WL7l4nk.jpg,"[{'name': 'WingNut Films', 'id': 11}, {'name': 'New Line Cinema', 'id': 12}, {'name': 'Warner Bros. Pictures', 'id': 174}, {'name': 'Metro-Goldwyn-Mayer (MGM)', 'id': 8411}]","[{'iso_3166_1': 'NZ', 'name': 'New Zealand'}, {'iso_3166_1': 'US', 'name': 'United States of America'}]",2012.11.26,1021103568,169,"[{'iso_639_1': 'en', 'name': 'English'}]",Released,From the smallest beginnings come the greatest legends.,The Hobbit: An Unexpected Journey,FALSE,7,8427
FALSE,,25000000,"[{'id': 18, 'name': 'Drama'}, {'id': 80, 'name': 'Crime'}]",,278,tt0111161,en,The Shawshank Redemption,"Framed in the 1940s for the double murder of his wife and her lover, upstanding banker Andy Dufresne begins a new life at the Shawshank prison, where he puts his accounting skills to work for an amoral warden. During his long stretch in prison, Dufresne comes to be admired by the other inmates -- including an older prisoner named Red -- for his integrity and unquenchable sense of hope.",51.645403,/9O7gLzmreU0nGkIB6K3BsJbzvNv.jpg,"[{'name': 'Castle Rock Entertainment', 'id': 97}, {'name': 'Warner Bros.', 'id': 6194}]","[{'iso_3166_1': 'US', 'name': 'United States of America'}]",1994.9.23,28341469,142,"[{'iso_639_1': 'en', 'name': 'English'}]",Released,Fear can hold you prisoner. Hope can set you free.,The Shawshank Redemption,FALSE,8.5,8358
FALSE,"{'id': 119, 'name': 'The Lord of the Rings Collection', 'poster_path': '/p4UokEk2XnjjRTdXGe6DLYXlbI1.jpg', 'backdrop_path': '/bccR2CGTWVVSZAG0yqmy3DIvhTX.jpg'}",94000000,"[{'id': 12, 'name': 'Adventure'}, {'id': 14, 'name': 'Fantasy'}, {'id': 28, 'name': 'Action'}]",http://www.lordoftherings.net,122,tt0167260,en,The Lord of the Rings: The Return of the King,"Aragorn is revealed as the heir to the ancient kings as he, Gandalf and the other members of the broken fellowship struggle to save Gondor from Sauron's forces. Meanwhile, Frodo and Sam bring the ring closer to the heart of Mordor, the dark lord's realm.",29.324358,/uexxR7Kw1qYbZk0RYaF9Rx5ykbj.jpg,"[{'name': 'WingNut Films', 'id': 11}, {'name': 'New Line Cinema', 'id': 12}]","[{'iso_3166_1': 'NZ', 'name': 'New Zealand'}, {'iso_3166_1': 'US', 'name': 'United States of America'}]",2003.12.1,1118888979,201,"[{'iso_639_1': 'en', 'name': 'English'}]",Released,The eye of the enemy is moving.,The Lord of the Rings: The Return of the King,FALSE,8.1,8226
FALSE,,55000000,"[{'id': 35, 'name': 'Comedy'}, {'id': 18, 'name': 'Drama'}, {'id': 10749, 'name': 'Romance'}]",,13,tt0109830,en,Forrest Gump,"A man with a low IQ has accomplished great things in his life and been present during significant historic events - in each case, far exceeding what anyone imagined he could do. Yet, despite all the things he has attained, his one true love eludes him. 'Forrest Gump' is the story of a man who rose above his challenges, and who proved that determination, courage, and love are more important than ability.",48.307194,/yE5d3BUhE8hCnkMUJOo1QDoOGNz.jpg,"[{'name': 'Paramount Pictures', 'id': 4}]","[{'iso_3166_1': 'US', 'name': 'United States of America'}]",1994.7.6,677945399,142,"[{'iso_639_1': 'en', 'name': 'English'}]",Released,"The world will never be the same, once you've seen it through the eyes of Forrest Gump.",Forrest Gump,FALSE,8.2,8147
FALSE,"{'id': 10, 'name': 'Star Wars Collection', 'poster_path': '/ghd5zOQnDaDW1mxO7R5fXXpZMu.jpg', 'backdrop_path': '/d8duYyyC9J5T825Hg7grmaabfxQ.jpg'}",245000000,"[{'id': 28, 'name': 'Action'}, {'id': 12, 'name': 'Adventure'}, {'id': 878, 'name': 'Science Fiction'}, {'id': 14, 'name': 'Fantasy'}]",http://www.starwars.com/films/star-wars-episode-vii,140607,tt2488496,en,Star Wars: The Force Awakens,"Thirty years after defeating the Galactic Empire, Han Solo and his allies face a new threat from the evil Kylo Ren and his army of Stormtroopers.",31.626013,/weUSwMdQIa3NaXVzwUoIIcAi85d.jpg,"[{'name': 'Lucasfilm', 'id': 1}, {'name': 'Truenorth Productions', 'id': 1634}, {'name': 'Bad Robot', 'id': 11461}]","[{'iso_3166_1': 'US', 'name': 'United States of America'}]",2015.12.15,2068223624,136,"[{'iso_639_1': 'en', 'name': 'English'}]",Released,Every generation has a story.,Star Wars: The Force Awakens,FALSE,7.5,7993
FALSE,,200000000,"[{'id': 18, 'name': 'Drama'}, {'id': 10749, 'name': 'Romance'}, {'id': 53, 'name': 'Thriller'}]",http://www.titanicmovie.com,597,tt0120338,en,Titanic,"84 years later, a 101-year-old woman named Rose DeWitt Bukater tells the story to her granddaughter Lizzy Calvert, Brock Lovett, Lewis Bodine, Bobby Buell and Anatoly Mikailavich on the Keldysh about her life set in April 10th 1912, on a ship called Titanic when young Rose boards the departing ship with the upper-class passengers and her mother, Ruth DeWitt Bukater, and her fiancé, Caledon Hockley. Meanwhile, a drifter and artist named Jack Dawson and his best friend Fabrizio De Rossi win third-class tickets to the ship in a game. And she explains the whole story from departure until the death of Titanic on its first and last voyage April 15th, 1912 at 2:20 in the morning.",26.88907,/kHXEpyfl6zqn8a6YuozZUujufXf.jpg,"[{'name': 'Paramount Pictures', 'id': 4}, {'name': 'Twentieth Century Fox Film Corporation', 'id': 306}, {'name': 'Lightstorm Entertainment', 'id': 574}]","[{'iso_3166_1': 'US', 'name': 'United States of America'}]",1997.11.18,1845034188,194,"[{'iso_639_1': 'en', 'name': 'English'}, {'iso_639_1': 'fr', 'name': 'Français'}, {'iso_639_1': 'de', 'name': 'Deutsch'}, {'iso_639_1': 'sv', 'name': 'svenska'}, {'iso_639_1': 'it', 'name': 'Italiano'}, {'iso_639_1': 'ru', 'name': 'Pкий'}]",Released,Nothing on Earth could come between them.,Titanic,FALSE,7.5,7770
