FALSE,"{'id': 209131, 'name': 'Man of Steel Collection', 'poster_path': '/rNnIW6xSPeTiIUtsfEhFeIRiJVv.jpg', 'backdrop_path': '/csERw2A3XIsGegkzil6UGpyhqfw.jpg'}",225000000,"[{'id': 28, 'name': 'Action'}, {'id': 12, 'name': 'Adventure'}, {'id': 14, 'name': 'Fantasy'}, {'id': 878, 'name': 'Science Fiction'}]",http://www.manofsteel.com/,49521,tt0770828,en,Man of Steel,"A young boy learns that he has extraordinary powers and is not of this earth. As a young man, he journeys to discover where he came from and what he was sent here to do. But the hero in him must emerge if he is to save the world from annihilation and become the symbol of hope for all mankind.",18.538834,/xWlaTLnD8NJMTT9PGOD9z5re1SL.jpg,"[{'name': 'Legendary Pictures', 'id': 923}, {'name': 'Warner Bros.', 'id': 6194}, {'name': 'DC Entertainment', 'id': 9993}, {'name': 'Syncopy', 'id': 9996}, {'name': 'Cruel and Unusual Films', 'id': 78685}]","[{'iso_3166_1': 'GB', 'name': 'United Kingdom'}, {'iso_3166_1': 'US', 'name': 'United States of America'}]",2013.6.12,662845518,143,"[{'iso_639_1': 'en', 'name': 'English'}]",Released,You will believe that a man can fly.,Man of Steel,FALSE,6.5,6462
FALSE,,180000000,"[{'id': 16, 'name': 'Animation'}, {'id': 10751, 'name': 'Family'}]",http://disney.go.com/disneypictures/wall-e/,10681,tt0910970,en,WALL·E,"WALL·E is the last robot left on an Earth that has been overrun with garbage and all humans have fled to outer space. For 700 years he has continued to try and clean up the mess, but has developed some rather interesting human-like qualities. When a ship arrives with a sleek new type of robot, WALL·E thinks he's finally found a friend and stows away on the ship when it leaves.",16.088366,/9cJETuLMc6R0bTWRA5i7ctY9bxk.jpg,"[{'name': 'Walt Disney Pictures', 'id': 2}, {'name': 'Pixar Animation Studios', 'id': 3}, {'name': 'FortyFour Studios', 'id': 93408}]","[{'iso_3166_1': 'US', 'name': 'United States of America'}]",2008.6.22,521311860,98,"[{'iso_639_1': 'en', 'name': 'English'}]",Released,An adventure beyond the ordinar-E.,WALL·E,FALSE,7.8,6439
FALSE,"{'id': 86119, 'name': 'The Hangover Collection', 'poster_path': '/aMmNLuyXvdBih1R5RRHtdtNaS6N.jpg', 'backdrop_path': '/uEtsf26a9RsRDy85MOIv1xAj44x.jpg'}",35000000,"[{'id': 35, 'name': 'Comedy'}]",http://hangoverpart2.warnerbros.com/dvd/,18785,tt1119646,en,The Hangover,"When three friends finally come to after a raucous night of bachelor-party revelry, they find a baby in the closet and a tiger in the bathroom. But they can't seem to locate their best friend, Doug  who's supposed to be tying the knot. Launching a frantic search for Doug, the trio perseveres through a nasty hangover to try to make it to the church on time.",23.947351,/uluhlXubGu1VxU63X9VHCLWDAYP.jpg,"[{'name': 'Legendary Pictures', 'id': 923}, {'name': 'Green Hat Films', 'id': 3527}, {'name': 'Warner Bros.', 'id': 6194}, {'name': 'IFP Westcoast Erste', 'id': 12235}]","[{'iso_3166_1': 'DE', 'name': 'Germany'}, {'iso_3166_1': 'US', 'name': 'United States of America'}]",2009.6.5,459270619,100,"[{'iso_639_1': 'en', 'name': 'English'}]",Released,Some guys just can't handle Vegas.,The Hangover,FALSE,7.2,6324
FALSE,"{'id': 453993, 'name': 'The Wolverine Collection', 'poster_path': '/8Ht4a5A5Ypxh0PjbVoRTzm1kAu3.jpg', 'backdrop_path': '/QtSxEuCwcZSfCTMZfER3nHDVsG.jpg'}",97000000,"[{'id': 28, 'name': 'Action'}, {'id': 18, 'name': 'Drama'}, {'id': 878, 'name': 'Science Fiction'}]",http://www.foxmovies.com/movies/logan,263115,tt3315342,en,Logan,"In the near future, a weary Logan cares for an ailing Professor X in a hideout on the Mexican border. But Logan's attempts to hide from the world and his legacy are upended when a young mutant arrives, pursued by dark forces.",54.581997,/gGBu0hKw9BGddG8RkRAMX7B6NDB.jpg,"[{'name': 'Twentieth Century Fox Film Corporation', 'id': 306}, {'name': ""Donners' Company"", 'id': 431}, {'name': 'Marvel Entertainment', 'id': 7505}, {'name': 'TSG Entertainment', 'id': 22213}]","[{'iso_3166_1': 'US', 'name': 'United States of America'}]",2017.2.28,616801808,137,"[{'iso_639_1': 'en', 'name': 'English'}, {'iso_639_1': 'es', 'name': 'Español'}]",Released,His time has come,Logan,FALSE,7.6,6310
FALSE,"{'id': 137697, 'name': 'Finding Nemo Collection', 'poster_path': '/xwggrEugjcJDuabIWvK2CpmK91z.jpg', 'backdrop_path': '/2hC8HHRUvwRljYKIcQDMyMbLlxz.jpg'}",94000000,"[{'id': 16, 'name': 'Animation'}, {'id': 10751, 'name': 'Family'}]",http://movies.disney.com/finding-nemo,12,tt0266543,en,Finding Nemo,"Nemo, an adventurous young clownfish, is unexpectedly taken from his Great Barrier Reef home to a dentist's office aquarium. It's up to his worrisome father Marlin and a friendly but forgetful fish Dory to bring Nemo home -- meeting vegetarian sharks, surfer dude turtles, hypnotic jellyfish, hungry seagulls, and more along the way.",25.497794,/syPWyeeqzTQIxjIUaIFI7d0TyEY.jpg,"[{'name': 'Pixar Animation Studios', 'id': 3}]","[{'iso_3166_1': 'US', 'name': 'United States of America'}]",2003.5.30,940335536,100,"[{'iso_639_1': 'en', 'name': 'English'}]",Released,There are 3.7 trillion fish in the ocean. They're looking for one.,Finding Nemo,FALSE,7.6,6292
FALSE,,165000000,"[{'id': 12, 'name': 'Adventure'}, {'id': 10751, 'name': 'Family'}, {'id': 16, 'name': 'Animation'}, {'id': 28, 'name': 'Action'}, {'id': 35, 'name': 'Comedy'}]",http://movies.disney.com/big-hero-6,177572,tt2245084,en,Big Hero 6,"The special bond that develops between plus-sized inflatable robot Baymax, and prodigy Hiro Hamada, who team up with a group of friends to form a band of high-tech heroes.",213.849907,/9gLu47Zw5ertuFTZaxXOvNfy78T.jpg,"[{'name': 'Walt Disney Pictures', 'id': 2}, {'name': 'Walt Disney Animation Studios', 'id': 6125}]","[{'iso_3166_1': 'US', 'name': 'United States of America'}]",2014.10.24,652105443,102,"[{'iso_639_1': 'en', 'name': 'English'}]",Released,From the creators of Wreck-it Ralph and Frozen,Big Hero 6,FALSE,7.8,6289
FALSE,"{'id': 264, 'name': 'Back to the Future Collection', 'poster_path': '/UV8VEgAxgKVnCVnZhFACmhxjE4.jpg', 'backdrop_path': '/c9C9Pg2QctyjZHRmS0P8rZg1OTA.jpg'}",19000000,"[{'id': 12, 'name': 'Adventure'}, {'id': 35, 'name': 'Comedy'}, {'id': 878, 'name': 'Science Fiction'}, {'id': 10751, 'name': 'Family'}]",http://www.backtothefuture.com/movies/backtothefuture1,105,tt0088763,en,Back to the Future,"Eighties teenager Marty McFly is accidentally sent back in time to 1955, inadvertently disrupting his parents' first meeting and attracting his mother's romantic interest. Marty must repair the damage to history by rekindling his parents' romance and - with the help of his eccentric inventor friend Doc Brown - return to 1985.",25.778509,/pTpxQB1N0waaSc3OSn0e9oc8kx9.jpg,"[{'name': 'Universal Pictures', 'id': 33}, {'name': 'Amblin Entertainment', 'id': 56}, {'name': 'U-Drive Productions', 'id': 20448}]","[{'iso_3166_1': 'US', 'name': 'United States of America'}]",1985.7.3,381109762,116,"[{'iso_639_1': 'en', 'name': 'English'}]",Released,He's the only kid ever to get into trouble before he was born.,Back to the Future,FALSE,8,6239
FALSE,"{'id': 748, 'name': 'X-Men Collection', 'poster_path': '/1Zo4J5SAni8lyXt7NxJwJZ0f0ip.jpg', 'backdrop_path': '/Abnosho2v3bcdvDww6T7Hfeczm1.jpg'}",250000000,"[{'id': 28, 'name': 'Action'}, {'id': 12, 'name': 'Adventure'}, {'id': 14, 'name': 'Fantasy'}, {'id': 878, 'name': 'Science Fiction'}]",http://www.x-menmovies.com/,127585,tt1877832,en,X-Men: Days of Future Past,The ultimate X-Men ensemble fights a war for the survival of the species across two time periods as they join forces with their younger selves in an epic battle that must change the past  to save our future.,26.058586,/giUK8ppRbfistadVzHtpainkhq4.jpg,"[{'name': 'Twentieth Century Fox Film Corporation', 'id': 306}, {'name': ""Donners' Company"", 'id': 431}, {'name': 'Marvel Entertainment', 'id': 7505}, {'name': 'Bad Hat Harry Productions', 'id': 9168}, {'name': 'TSG Entertainment', 'id': 22213}, {'name': 'Down Productions', 'id': 37336}, {'name': 'Revolution Sun Studios', 'id': 76043}]","[{'iso_3166_1': 'GB', 'name': 'United Kingdom'}, {'iso_3166_1': 'US', 'name': 'United States of America'}]",2014.5.15,747862775,131,"[{'iso_639_1': 'en', 'name': 'English'}]",Released,"To save the future, they must alter the past",X-Men: Days of Future Past,FALSE,7.5,6155
FALSE,"{'id': 137696, 'name': 'Monsters, Inc. Collection', 'poster_path': '/8xHtCUKfre8b4tkpUWU1y67Cnqr.jpg', 'backdrop_path': '/uzKkKhTWGSEdsN2rYanJTVAyTLi.jpg'}",115000000,"[{'id': 16, 'name': 'Animation'}, {'id': 35, 'name': 'Comedy'}, {'id': 10751, 'name': 'Family'}]",http://movies.disney.com/monsters-inc,585,tt0198781,en,"Monsters, Inc.","James Sullivan and Mike Wazowski are monsters, they earn their living scaring children and are the best in the business... even though they're more afraid of the children than they are of them. When a child accidentally enters their world, James and Mike suddenly find that kids are not to be afraid of and they uncover a conspiracy that could threaten all children across the world.",26.419962,/93Y9BGx8blzmZOPSoivkFfaifqU.jpg,"[{'name': 'Walt Disney Pictures', 'id': 2}, {'name': 'Pixar Animation Studios', 'id': 3}]","[{'iso_3166_1': 'US', 'name': 'United States of America'}]",2001.11.1,562816256,92,"[{'iso_639_1': 'en', 'name': 'English'}]",Released,We Scare Because We Care.,"Monsters, Inc.",FALSE,7.5,6150
FALSE,"{'id': 1241, 'name': 'Harry Potter Collection', 'poster_path': '/8Xmkc1HvCOpMlbFvVabrtr6HAsp.jpg', 'backdrop_path': '/wfnMt6LGqYHcNyOfsuusw5lX3bL.jpg'}",125000000,"[{'id': 10751, 'name': 'Family'}, {'id': 14, 'name': 'Fantasy'}, {'id': 12, 'name': 'Adventure'}]",http://www.harrypotter.com,12445,tt1201607,en,Harry Potter and the Deathly Hallows: Part 2,"Harry, Ron and Hermione continue their quest to vanquish the evil Voldemort once and for all. Just as things begin to look hopeless for the young wizards, Harry discovers a trio of magical objects that endow him with powers to rival Voldemort's formidable skills.",24.990737,/fTplI1NCSuEDP4ITLcTps739fcC.jpg,"[{'name': 'Warner Bros.', 'id': 6194}, {'name': 'Heyday Films', 'id': 7364}]","[{'iso_3166_1': 'GB', 'name': 'United Kingdom'}, {'iso_3166_1': 'US', 'name': 'United States of America'}]",2011.7.7,1342000000,130,"[{'iso_639_1': 'en', 'name': 'English'}]",Released,It all ends here.,Harry Potter and the Deathly Hallows: Part 2,FALSE,7.9,6141
FALSE,"{'id': 391860, 'name': 'Kingsman Collection', 'poster_path': '/2WjphvZVZQeQfOZeZrBmFUGXmXp.jpg', 'backdrop_path': '/8XZnIWG7on74SaJ6t23kdPOYXUG.jpg'}",81000000,"[{'id': 80, 'name': 'Crime'}, {'id': 35, 'name': 'Comedy'}, {'id': 28, 'name': 'Action'}, {'id': 12, 'name': 'Adventure'}]",http://www.kingsmanmovie.com/,207703,tt2802144,en,Kingsman: The Secret Service,The story of a super-secret spy organization that recruits an unrefined but promising street kid into the agency's ultra-competitive training program just as a global threat emerges from a twisted tech genius.,28.224212,/8x7ej0LnHdKUqilNNJXYOeyB6L9.jpg,"[{'name': 'Twentieth Century Fox Film Corporation', 'id': 306}, {'name': 'Marv Films', 'id': 5374}, {'name': 'TSG Entertainment', 'id': 22213}, {'name': 'Cloudy Productions', 'id': 78995}]","[{'iso_3166_1': 'GB', 'name': 'United Kingdom'}, {'iso_3166_1': 'US', 'name': 'United States of America'}]",2015.1.29,414351546,130,"[{'iso_639_1': 'en', 'name': 'English'}]",Released,Manners maketh man.,Kingsman: The Secret Service,FALSE,7.6,6069
FALSE,,40000000,"[{'id': 28, 'name': 'Action'}, {'id': 878, 'name': 'Science Fiction'}]",http://lucymovie.com/,240832,tt2872732,en,Lucy,"A woman, accidentally caught in a dark deal, turns the tables on her captors and transforms into a merciless warrior evolved beyond human logic.",36.447603,/rwn876MeqienhOVSSjtUPnwxn0Z.jpg,"[{'name': 'Universal Pictures', 'id': 33}, {'name': 'TF1 Films Production', 'id': 3823}, {'name': 'Canal+', 'id': 5358}, {'name': 'EuropaCorp', 'id': 6896}, {'name': 'Ciné+', 'id': 23616}]","[{'iso_3166_1': 'FR', 'name': 'France'}, {'iso_3166_1': 'US', 'name': 'United States of America'}]",2014.7.14,126546825,89,"[{'iso_639_1': 'zh', 'name': '__'}, {'iso_639_1': 'en', 'name': 'English'}, {'iso_639_1': 'fr', 'name': 'Français'}, {'iso_639_1': 'es', 'name': 'Español'}, {'iso_639_1': 'ko', 'name': '_��/조�_�'}]",Released,The average person uses 10% of their brain capacity. Imagine what she could do with 100%.,Lucy,FALSE,6.3,6048
FALSE,"{'id': 1241, 'name': 'Harry Potter Collection', 'poster_path': '/8Xmkc1HvCOpMlbFvVabrtr6HAsp.jpg', 'backdrop_path': '/wfnMt6LGqYHcNyOfsuusw5lX3bL.jpg'}",130000000,"[{'id': 12, 'name': 'Adventure'}, {'id': 14, 'name': 'Fantasy'}, {'id': 10751, 'name': 'Family'}]",,673,tt0304141,en,Harry Potter and the Prisoner of Azkaban,"Harry, Ron and Hermione return to Hogwarts for another magic-filled year. Harry comes face to face with danger yet again, this time in the form of escaped convict, Sirius Black  and turns to sympathetic Professor Lupin for help.",28.460276,/jUFjMoLh8T2CWzHUSjKCojI5SHu.jpg,"[{'name': '1492 Pictures', 'id': 436}, {'name': 'Heyday films', 'id': 437}, {'name': 'Warner Bros.', 'id': 6194}]","[{'iso_3166_1': 'GB', 'name': 'United Kingdom'}, {'iso_3166_1': 'US', 'name': 'United States of America'}]",2004.5.31,789804554,141,"[{'iso_639_1': 'en', 'name': 'English'}]",Released,Something wicked this way comes.,Harry Potter and the Prisoner of Azkaban,FALSE,7.7,6037
FALSE,"{'id': 422834, 'name': 'Ant-Man Collection', 'poster_path': '/lEdpEJWJdtVLgmpPkXSTd2xczmY.jpg', 'backdrop_path': '/2KjtWUBiksmN8LsUouaZnxocu5N.jpg'}",130000000,"[{'id': 878, 'name': 'Science Fiction'}, {'id': 28, 'name': 'Action'}, {'id': 12, 'name': 'Adventure'}]",http://marvel.com/movies/movie/180/ant-man,102899,tt0478970,en,Ant-Man,"Armed with the astonishing ability to shrink in scale but increase in strength, master thief Scott Lang must embrace his inner-hero and help his mentor, Doctor Hank Pym, protect the secret behind his spectacular Ant-Man suit from a new generation of towering threats. Against seemingly insurmountable obstacles, Pym and Lang must plan and pull off a heist that will save the world.",26.882388,/D6e8RJf2qUstnfkTslTXNTUAlT.jpg,"[{'name': 'Marvel Studios', 'id': 420}]","[{'iso_3166_1': 'US', 'name': 'United States of America'}]",2015.7.14,519311965,117,"[{'iso_639_1': 'en', 'name': 'English'}]",Released,Heroes don't get any bigger.,Ant-Man,FALSE,7,6029
FALSE,"{'id': 230, 'name': 'The Godfather Collection', 'poster_path': '/7SJVjEDoo7xH62TS8stkqRk4Byo.jpg', 'backdrop_path': '/3WZTxpgscsmoUk81TuECXdFOD0R.jpg'}",6000000,"[{'id': 18, 'name': 'Drama'}, {'id': 80, 'name': 'Crime'}]",http://www.thegodfather.com/,238,tt0068646,en,The Godfather,"Spanning the years 1945 to 1955, a chronicle of the fictional Italian-American Corleone crime family. When organized crime family patriarch, Vito Corleone barely survives an attempt on his life, his youngest son, Michael steps in to take care of the would-be killers, launching a campaign of bloody revenge.",41.109264,/rPdtLWNsZmAtoZl9PK7S2wE3qiS.jpg,"[{'name': 'Paramount Pictures', 'id': 4}, {'name': 'Alfran Productions', 'id': 10211}]","[{'iso_3166_1': 'US', 'name': 'United States of America'}]",1972.3.14,245066411,175,"[{'iso_639_1': 'en', 'name': 'English'}, {'iso_639_1': 'it', 'name': 'Italiano'}, {'iso_639_1': 'la', 'name': 'Latin'}]",Released,An offer you can't refuse.,The Godfather,FALSE,8.5,6024
FALSE,,61000000,"[{'id': 9648, 'name': 'Mystery'}, {'id': 53, 'name': 'Thriller'}, {'id': 18, 'name': 'Drama'}]",http://www.gonegirlmovie.com/,210577,tt2267998,en,Gone Girl,"With his wife's disappearance having become the focus of an intense media circus, a man sees the spotlight turned on him when it's suspected that he may not be innocent.",154.801009,/gdiLTof3rbPDAmPaCf4g6op46bj.jpg,"[{'name': 'Twentieth Century Fox Film Corporation', 'id': 306}, {'name': 'Regency Enterprises', 'id': 508}, {'name': 'New Regency Pictures', 'id': 10104}, {'name': 'Pacific Standard', 'id': 15829}, {'name': 'TSG Entertainment', 'id': 22213}, {'name': 'Artemple - Hollywood', 'id': 60682}]","[{'iso_3166_1': 'US', 'name': 'United States of America'}]",2014.10.1,369330363,145,"[{'iso_639_1': 'en', 'name': 'English'}]",Released,You don't know what you've got 'til it's...,Gone Girl,FALSE,7.9,6023
FALSE,"{'id': 10, 'name': 'Star Wars Collection', 'poster_path': '/ghd5zOQnDaDW1mxO7R5fXXpZMu.jpg', 'backdrop_path': '/d8duYyyC9J5T825Hg7grmaabfxQ.jpg'}",18000000,"[{'id': 12, 'name': 'Adventure'}, {'id': 28, 'name': 'Action'}, {'id': 878, 'name': 'Science Fiction'}]",http://www.starwars.com/films/star-wars-episode-v-the-empire-strikes-back,1891,tt0080684,en,The Empire Strikes Back,"The epic saga continues as Luke Skywalker, in hopes of defeating the evil Galactic Empire, learns the ways of the Jedi from aging master Yoda. But Darth Vader is more determined than ever to capture Luke. Meanwhile, rebel leader Princess Leia, cocky Han Solo, Chewbacca, and droids C-3PO and R2-D2 are thrown into various stages of capture, betrayal and despair.",19.470959,/6u1fYtxG5eqjhtCPDx04pJphQRW.jpg,"[{'name': 'Lucasfilm', 'id': 1}, {'name': 'Twentieth Century Fox Film Corporation', 'id': 306}]","[{'iso_3166_1': 'US', 'name': 'United States of America'}]",1980.5.17,538400000,124,"[{'iso_639_1': 'en', 'name': 'English'}]",Released,The Adventure Continues...,The Empire Strikes Back,FALSE,8.2,5998
FALSE,"{'id': 1241, 'name': 'Harry Potter Collection', 'poster_path': '/8Xmkc1HvCOpMlbFvVabrtr6HAsp.jpg', 'backdrop_path': '/wfnMt6LGqYHcNyOfsuusw5lX3bL.jpg'}",100000000,"[{'id': 12, 'name': 'Adventure'}, {'id': 14, 'name': 'Fantasy'}, {'id': 10751, 'name': 'Family'}]",,672,tt0295297,en,Harry Potter and the Chamber of Secrets,"Ignoring threats to his life, Harry returns to Hogwarts to investigate  aided by Ron and Hermione  a mysterious series of attacks.",29.741452,/sdEOH0992YZ0QSxgXNIGLq1ToUi.jpg,"[{'name': '1492 Pictures', 'id': 436}, {'name': 'Heyday films', 'id': 437}, {'name': 'Warner Bros.', 'id': 6194}]","[{'iso_3166_1': 'DE', 'name': 'Germany'}, {'iso_3166_1': 'GB', 'name': 'United Kingdom'}, {'iso_3166_1': 'US', 'name': 'United States of America'}]",2002.11.13,876688482,161,"[{'iso_639_1': 'en', 'name': 'English'}]",Released,Hogwarts is back in session.,Harry Potter and the Chamber of Secrets,FALSE,7.4,5966
FALSE,,33000000,"[{'id': 80, 'name': 'Crime'}, {'id': 9648, 'name': 'Mystery'}, {'id': 53, 'name': 'Thriller'}]",http://www.sevenmovie.com/,807,tt0114369,en,Se7en,"Two homicide detectives are on a desperate hunt for a serial killer whose crimes are based on the ""seven deadly sins"" in this dark and haunting film that takes viewers from the tortured remains of one victim to the next. The seasoned Det. Sommerset researches each sin in an effort to get inside the killer's mind, while his novice partner, Mills, scoffs at his efforts to unravel the case.",18.45743,/8zw8IL4zEPjkh8Aysdcd0FwGMb0.jpg,"[{'name': 'New Line Cinema', 'id': 12}, {'name': 'Juno Pix', 'id': 4286}, {'name': 'Cecchi Gori Pictures', 'id': 65394}]","[{'iso_3166_1': 'US', 'name': 'United States of America'}]",1995.9.22,327311859,127,"[{'iso_639_1': 'en', 'name': 'English'}]",Released,Seven deadly sins. Seven ways to die.,Se7en,FALSE,8.1,5915
FALSE,,120000000,"[{'id': 12, 'name': 'Adventure'}, {'id': 18, 'name': 'Drama'}, {'id': 28, 'name': 'Action'}]",http://www.lifeofpimovie.com/,87827,tt0454876,en,Life of Pi,"The story of an Indian boy named Pi, a zookeeper's son who finds himself in the company of a hyena, zebra, orangutan, and a Bengal tiger after a shipwreck sets them adrift in the Pacific Ocean.",14.045042,/sLYdcz7easaS7CmJGwQcVVYZqiF.jpg,"[{'name': 'Ingenious Film Partners', 'id': 289}, {'name': 'Ingenious Media', 'id': 290}, {'name': 'Dune Entertainment', 'id': 444}, {'name': 'Fox 2000 Pictures', 'id': 711}, {'name': 'Big Screen Productions', 'id': 10893}, {'name': 'Haishang Films', 'id': 13480}]","[{'iso_3166_1': 'US', 'name': 'United States of America'}, {'iso_3166_1': 'TW', 'name': 'Taiwan'}, {'iso_3166_1': 'GB', 'name': 'United Kingdom'}]",2012.11.20,609016565,127,"[{'iso_639_1': 'en', 'name': 'English'}, {'iso_639_1': 'fr', 'name': 'Français'}, {'iso_639_1': 'hi', 'name': 'हिन�_द�'}, {'iso_639_1': 'ja', 'name': '��_�'}, {'iso_639_1': 'zh', 'name': '__'}, {'iso_639_1': 'ta', 'name': 'த�ி��'}]",Released,Believe The Unbelievable,Life of Pi,FALSE,7.2,5912
FALSE,,14000000,"[{'id': 36, 'name': 'History'}, {'id': 18, 'name': 'Drama'}, {'id': 53, 'name': 'Thriller'}, {'id': 10752, 'name': 'War'}]",http://theimitationgamemovie.com/,205596,tt2084970,en,The Imitation Game,"Based on the real life story of legendary cryptanalyst Alan Turing, the film portrays the nail-biting race against time by Turing and his brilliant team of code-breakers at Britain's top-secret Government Code and Cypher School at Bletchley Park, during the darkest days of World War II.",31.59594,/noUp0XOqIcmgefRnRZa1nhtRvWO.jpg,"[{'name': 'Black Bear Pictures', 'id': 22146}, {'name': 'Bristol Automotive', 'id': 38145}]","[{'iso_3166_1': 'GB', 'name': 'United Kingdom'}]",2014.11.14,233555708,113,"[{'iso_639_1': 'en', 'name': 'English'}]",Released,The true enigma was the man who cracked the code.,The Imitation Game,FALSE,8,5895
FALSE,"{'id': 102322, 'name': 'Sherlock Holmes Collection', 'poster_path': '/bsUN9Ph1nUituteKWOhPQGguNXt.jpg', 'backdrop_path': '/aeLom584FZdu6253WMaYEUCrTdu.jpg'}",90000000,"[{'id': 28, 'name': 'Action'}, {'id': 12, 'name': 'Adventure'}, {'id': 80, 'name': 'Crime'}, {'id': 9648, 'name': 'Mystery'}]",http://sherlock-holmes-movie.warnerbros.com/,10528,tt0988045,en,Sherlock Holmes,"Eccentric consulting detective, Sherlock Holmes and Doctor John Watson battle to bring down a new nemesis and unravel a deadly plot that could destroy England.",15.68604,/22ngurXbLqab7Sko6aTSdwOCe5W.jpg,"[{'name': 'Village Roadshow Pictures', 'id': 79}, {'name': 'Silver Pictures', 'id': 1885}, {'name': 'Warner Bros.', 'id': 6194}, {'name': 'Internationale Filmproduktion Blackbird Dritte', 'id': 19855}, {'name': 'Wigram Productions', 'id': 23202}]","[{'iso_3166_1': 'DE', 'name': 'Germany'}, {'iso_3166_1': 'GB', 'name': 'United Kingdom'}, {'iso_3166_1': 'US', 'name': 'United States of America'}]",2009.12.23,524028679,128,"[{'iso_639_1': 'en', 'name': 'English'}, {'iso_639_1': 'fr', 'name': 'Français'}]",Released,Nothing escapes him.,Sherlock Holmes,FALSE,7,5883
FALSE,"{'id': 131295, 'name': 'Captain America Collection', 'poster_path': '/2tOgiY533JSFp7OrVlkeRJvsZpI.jpg', 'backdrop_path': '/nZSYqitBkAvmoq5IrsGsSWuhSC8.jpg'}",170000000,"[{'id': 28, 'name': 'Action'}, {'id': 12, 'name': 'Adventure'}, {'id': 878, 'name': 'Science Fiction'}]",http://www.captainamericathewintersoldiermovie.com,100402,tt1843866,en,Captain America: The Winter Soldier,"After the cataclysmic events in New York with The Avengers, Steve Rogers, aka Captain America is living quietly in Washington, D.C. and trying to adjust to the modern world. But when a S.H.I.E.L.D. colleague comes under attack, Steve becomes embroiled in a web of intrigue that threatens to put the world at risk. Joining forces with the Black Widow, Captain America struggles to expose the ever-widening conspiracy while fighting off professional assassins sent to silence him at every turn. When the full scope of the villainous plot is revealed, Captain America and the Black Widow enlist the help of a new ally, the Falcon. However, they soon find themselves up against an unexpected and formidable enemy_he Winter Soldier.",18.717704,/5TQ6YDmymBpnF005OyoB7ohZps9.jpg,"[{'name': 'Marvel Studios', 'id': 420}]","[{'iso_3166_1': 'US', 'name': 'United States of America'}]",2014.3.20,714766572,136,"[{'iso_639_1': 'en', 'name': 'English'}]",Released,In heroes we trust.,Captain America: The Winter Soldier,FALSE,7.6,5881
FALSE,,165000000,"[{'id': 28, 'name': 'Action'}, {'id': 12, 'name': 'Adventure'}, {'id': 14, 'name': 'Fantasy'}, {'id': 878, 'name': 'Science Fiction'}]",http://marvel.com/doctorstrange,284052,tt1211837,en,Doctor Strange,"After his career is destroyed, a brilliant but arrogant surgeon gets a new lease on life when a sorcerer takes him under his wing and trains him to defend the world against evil.",43.847654,/4PiiNGXj1KENTmCBHeN6Mskj2Fq.jpg,"[{'name': 'Walt Disney Pictures', 'id': 2}, {'name': 'Marvel Studios', 'id': 420}]","[{'iso_3166_1': 'US', 'name': 'United States of America'}]",2016.10.25,677718395,115,"[{'iso_639_1': 'en', 'name': 'English'}]",Released,Open your mind. Change your reality.,Doctor Strange,FALSE,7.1,5880
FALSE,,105000000,"[{'id': 878, 'name': 'Science Fiction'}, {'id': 53, 'name': 'Thriller'}, {'id': 18, 'name': 'Drama'}]",http://gravitymovie.warnerbros.com/,49047,tt1454468,en,Gravity,"Dr. Ryan Stone, a brilliant medical engineer on her first Shuttle mission, with veteran astronaut Matt Kowalsky in command of his last flight before retiring. But on a seemingly routine spacewalk, disaster strikes. The Shuttle is destroyed, leaving Stone and Kowalsky completely alone-tethered to nothing but each other and spiraling out into the blackness of space. The deafening silence tells them they have lost any link to Earth and any chance for rescue. As fear turns to panic, every gulp of air eats away at what little oxygen is left. But the only way home may be to go further out into the terrifying expanse of space.",18.50194,/uPxtxhB2Fy9ihVqtBtNGHmknJqV.jpg,"[{'name': 'Warner Bros.', 'id': 6194}, {'name': 'Heyday Films', 'id': 7364}, {'name': 'Esperanto Filmoj', 'id': 7470}]","[{'iso_3166_1': 'GB', 'name': 'United Kingdom'}, {'iso_3166_1': 'US', 'name': 'United States of America'}]",2013.9.27,716392705,91,"[{'iso_639_1': 'en', 'name': 'English'}]",Released,Don't Let Go,Gravity,FALSE,7.3,5879
